id,resolution,brand_name,description,name_rus,CommercialTypeName4,rating_1_count,rating_2_count,rating_3_count,rating_4_count,rating_5_count,comments_published_count,photos_published_count,videos_published_count,PriceDiscounted,item_time_alive,item_count_fake_returns7,item_count_fake_returns30,item_count_fake_returns90,item_count_sales7,item_count_sales30,item_count_sales90,item_count_returns7,item_count_returns30,item_count_returns90,GmvTotal7,GmvTotal30,GmvTotal90,ExemplarAcceptedCountTotal7,ExemplarAcceptedCountTotal30,ExemplarAcceptedCountTotal90,OrderAcceptedCountTotal7,OrderAcceptedCountTotal30,OrderAcceptedCountTotal90,ExemplarReturnedCountTotal7,ExemplarReturnedCountTotal30,ExemplarReturnedCountTotal90,ExemplarReturnedValueTotal7,ExemplarReturnedValueTotal30,ExemplarReturnedValueTotal90,ItemVarietyCount,ItemAvailableCount,seller_time_alive,ItemID,SellerID
237562,0,Garmin,"Ключевые показатели: <br/><br/>1,3-дюймовый цветной amoled-дисплей <br/><br/>до 20 часов автономной работы в режиме GPS <br/><br/>расширенные показатели обучения и информация о восстановлении <br/><br/>SATI и многодиапазонный GPS <br/><br/>музыка на вашем запястье. <br/><br/>Функции: <br/><br/>УТРЕННИЙ ОТЧЕТ <br/><br/>Получите обзор вашего режима сна и перспектив тренировок, как только проснетесь, наряду со статусом ВСР и погодой. <br/><br/>Вы даже можете настроить свой отчет так, чтобы он показывал вам то, что вы хотите видеть ВИДЖЕТ ГОНКИ <br/><br/>Приготовьтесь к своей следующей гонке будь то забег на 10 к",Спортивные часы Garmin FORERUNNER 265 Black,Часы наручные спортивные унисекс,,,,,,,,,1104.7314470068227,74,0,0,0,0,0,0,0,0,0,1358.6921373490145,1462.0302508478944,1599.5472459030125,27.0,81.0,253.0,27.0,80.0,249.0,2.0,6.0,9.0,1046.5118033583203,1195.3629953894947,1236.0944744345245,1.0,1.0,747.0,116642,2894
232336,0,VIXION,"Аккумулятор на смартфон или телефон с емкостью 2400mAh обеспечит высокую автономность вашему девайсу. li-ion батарея полностью совместима с указанной в характеристике моделью телефона. Компактный источник энергии с напряжением 3.85v прост в эксплуатации, безопасен и долговечен. Для каждой батарейки Vixion отбираются лучшие компоненты, произведенные по оригинальным технологиям. АКБ Vixion имеет качественные платы контроллеров, установленные для корректировки отдаваемого напряжения. Батарею для сотового телефона можно заменить самостоятельно, но мы рекомендуем ",Аккумулятор для Samsung J330F Galaxy J3 (2017) (EB-BJ330ABE),Аккумулятор для мобильного телефона,,,,,,,,,718.0760365470819,545,0,0,0,0,2,3,0,0,0,1285.5577427282788,1416.3051087594804,1545.7582003556283,792.0,2713.0,9157.0,761.0,2597.0,8584.0,14.0,59.0,219.0,869.942310427817,1061.2646272412658,1194.07935626954,1.0,1.0,1429.0,114062,158
179556,0,,Плата для ноутбука Apple a1115 a1224 a1225 iMac 20 24 IR / 820-2151-A,Плата для ноутбука Apple a1115 a1224 a1225 iMac 20 24 IR / 820-2151-A,Вентилятор для ноутбука,,,,,,,,,711.6267998681335,79,0,0,0,0,0,0,0,0,0,986.4426903395428,1112.4291314097932,1198.0561153278445,14.0,58.0,145.0,14.0,57.0,144.0,0.0,2.0,8.0,0.0,789.5638180316835,910.0529717838156,27.0,27.0,477.0,87915,1498
391968,0,,,Дисплей для Xiaomi Redmi Note 5/Note 5 Pro с тачскрином (черный),Дисплеи для телефонов,,,,,,,,,805.6298864022809,1028,0,0,0,0,0,0,0,0,0,1197.751095547427,1355.431751662229,1467.003829348611,140.0,623.0,2018.0,138.0,617.0,1995.0,14.0,53.0,137.0,993.1412327946124,1125.2353891821326,1215.332823442647,48.0,48.0,1075.0,191837,1684
424022,1,Электроград,,"Элемент питания тип-АА LR6-4BL 1,5v (4шт/упак) Power",Типовая батарейка,,,,,,,,,617.7082924023606,1,0,0,0,0,0,0,0,0,0,1457.6751510592364,1619.7040587216377,1677.8102503368368,714.0,3129.0,5967.0,577.0,2588.0,4892.0,12.0,48.0,75.0,1081.7349378357635,1201.8739335947344,1237.6047870575806,5.0,5.0,128.0,206662,5620
178563,0,,Внимание! Перед заказом сравните фото товара с подсветкой вашего телевизора.<br>Подходит для телевизора : SAMSUNG UЕ49NU7099U<br>Характеристики<br>Длина: 530 мм<br>Ширина: Не указано<br>Количество светодиодов: 38 LED<br>Напряжение светодиодов: 6 V<br>Комплект: 2 планки,Подсветка для телевизора SAMSUNG UE49NU7099U,Запчасти для телевизора,,,,,,,,,732.2758622667237,612,0,0,0,0,0,0,0,0,0,1065.1038299069935,1199.2137704973163,1283.8843357292074,72.0,259.0,497.0,60.0,230.0,465.0,4.0,11.0,17.0,835.0171017801458,947.677898784821,993.528069937412,99.0,99.0,853.0,87437,142
156246,0,,"Звонок (buzzer) для Huawei P40 Pro/P40 Pro Plus в сборе.Подарите своему смартфону новую жизнь,заменив несправную деталь на новую.Замену можно произвести и самому,но при этом нужно быть предельно аккуратным и нужно учитывать,что есть опасность испортить весь смартфон при разборке неумелыми действиями,кто сомневается- конечно-же лучше отдать специалистам. Все инструкции и видеоролики по разборке и установке есть в сети интернет.", Звонок (buzzer) для Huawei P40 Pro/P40 Pro Plus в сборе,Динамики/Звонки для телефонов,0.0,0.0,0.0,0.0,1.0,1.0,1.0,0.0,644.052036884485,493,0,0,0,0,0,0,0,0,0,1204.7439761715875,1351.913509008183,1479.9575095885875,559.0,1972.0,6203.0,448.0,1727.0,5471.0,7.0,42.0,146.0,768.8818786437884,1038.9492184323558,1124.4271478879798,1.0,1.0,495.0,76715,1181
6720,1,Бруталити,"Главное нововведение обновленного геймпада для PS4 — световая полоса на сенсорной панели. Она будет использоваться для индикации дополнительной игровой информации, например, отображать состояние здоровья персонажа. Также корпус геймпада и стики стали более износостойким.<br/><br/>Обновленный беспроводной контроллер расширяет границы и дает новые возможности в управлении игровыми и мультимедийными процессами PlayStation 4. В его облике и функциональности произошли значительные изменения, по сравнению со своим предшественником.<br/><br/>В верхней части располож","Бруталити Геймпад, Bluetooth, Проводной, зеленый",Геймпад для игровой приставки,0.0,0.0,0.0,1.0,1.0,0.0,1.0,1.0,750.4658621134083,917,0,0,0,0,1,1,0,0,0,682.0244174639538,792.8732658986974,1053.604083835247,1.0,2.0,26.0,1.0,2.0,23.0,0.0,0.0,1.0,0.0,0.0,686.3947644569254,4.0,4.0,918.0,3407,1462
363367,0,GARLYN,"Чаша для мультиварки GARLYN MR-Pro 20 объёмом в 5 литров позволит готовить блюда для всей семьи.<br/><br/>Повышенную прочность чаши обеспечивает антипригарное покрытие Daikin® по японским стандартам качества. Данный вид покрытия гарантирует превосходное качество и вкус приготовленных блюд, удобство пользования и многолетние сроки эксплуатации.<br/><br/>Чаша легко моется и не впитывает запахи, что позволяет использовать ее для приготовления самых разнообразных блюд",Чаша для мультиварки GARLYN MR-Pro 20,Аксессуары для мультиварок,0.0,0.0,0.0,1.0,12.0,14.0,2.0,1.0,794.127313861307,161,0,0,0,3,14,45,1,1,2,1688.3799961786417,1844.485918408865,1948.38944582524,1618.0,7426.0,23501.0,1558.0,7096.0,21767.0,67.0,221.0,1126.0,1372.579537158182,1494.6597390243032,1622.2861980916996,1.0,1.0,2207.0,178525,3048
387918,0,,,АКБ EB-BA700ABE для Samsung Galaxy A7 2015 (A700),Аккумулятор для мобильного телефона,,,,,,,,,633.4130189843446,676,0,0,0,0,0,0,0,0,0,949.1981760845638,1045.9657860966186,1203.9439996937836,13.0,35.0,171.0,12.0,34.0,170.0,0.0,2.0,3.0,0.0,755.7254404873972,802.1005134894401,8.0,8.0,1214.0,190005,3076
188699,0,realme,"Погрузитесь в мир новых технологий с смартфоном Realme C51. Этот стильный и мощный смартфон обеспечивает высокую производительность и удобство использования. С 6 ГБ оперативной памяти и 256 ГБ встроенной памяти у вас будет быстрая и плавная работа устройства, а также достаточно места для хранения всех ваших данных, фотографий и видео. Черный корпус смартфона Realme C51 придает ему элегантный и современный вид, который подчеркнет ваш стиль. Откройте для себя мир возможностей с Realme C51 и наслаждайтесь всеми преимуществами современного смартфона.","realme Смартфон C51 6/256 ГБ, черный",Смартфон,,,,,,,,,991.9634854472068,3,0,0,0,0,0,0,0,0,0,1019.3341276590146,1019.333988788086,1019.3355891126726,3.0,3.0,3.0,3.0,3.0,3.0,0.0,0.0,0.0,0.0,0.0,0.0,23.0,23.0,4.0,92332,546
392357,0,,,Корпус подходит для Nokia 7100 Supernova черный,Корпуса для телефонов,,,,,,,,,647.7895619289743,36,0,0,0,0,0,0,0,0,0,936.091446959276,1057.657495783746,1072.2843101044734,17.0,63.0,71.0,16.0,61.0,69.0,1.0,1.0,1.0,623.1514198290596,623.1437470673891,623.1494807502954,3.0,3.0,42.0,191961,849
14561,0,,Мешки подходят для пылесоса PHILIPS FC6842 TRIATHLON ( 4 шт бумажные),Мешки подходят для пылесоса PHILIPS (Филипс) FC6842 TRIATHLON ( 4 шт бумажные),Пылесборник,,,,,,,,,706.8733581968592,276,0,0,0,0,0,0,0,0,0,1317.207299973529,1480.2163196594252,1572.186564693855,411.0,2311.0,5950.0,384.0,2152.0,5522.0,15.0,46.0,127.0,977.6796737028347,1094.4121201071937,1194.2305372434705,14.0,14.0,310.0,7353,551
273950,0,Pro Cover,"Покрытие для MacBook Аir 13 M2/M3/M4<ul><li>изготавливается из премиального покрытия с микроканалами, которые не образуют пузыри при нанесении.</li><li>клеевой слой не оставляет следов, а также при неудачном нанесении покрытия с первого раза, можно повторить процедуру</li><li>мы принципиально не используем логотипы в дизайне принтов, никаких навязанных брендов на вашем устройстве</li><li>покрытие которое не увеличивает размеры и вес девайса, оставляя габаритный дизайн таким, каким его создали в Apple</li></ul>",Виниловая наклейка для MacBook Аir 13 M2/M3/M4 Крышка,Наклейка для ноутбука,,,,,,,,,727.7483033906418,515,0,0,0,0,1,1,0,0,0,1081.070355675631,1238.364746918992,1353.0888234674849,30.0,133.0,409.0,30.0,127.0,389.0,2.0,11.0,33.0,826.6776988235748,995.7534220085688,1096.02757772699,27.0,27.0,911.0,134691,137
47171,0,,Фильтр для пылесоса Samsung VC07M2110SR/EF,Фильтр для пылесоса Samsung VC07M2110SR/EF,HEPA фильтр,,,,,,,,,725.4849562061938,656,0,0,0,0,0,0,0,0,0,1132.276007227,1298.9119772177205,1432.433377919915,78.0,410.0,1577.0,65.0,370.0,1444.0,1.0,14.0,61.0,671.1766243508704,983.8576372228556,1117.027250457622,2.0,2.0,678.0,23534,28
11044,0,Joshua,"Беспроводной геймпад для PlayStationn 4 создает ощущение полного контроля над процессом игры. Геймпад разработан с учётом всех потребностей геймера. Геймпад поддерживает все функции для PS4. Все функции работают: сенсорная панель + динамик + разъем для наушников. Аккумулятора хватает на 8-10 часов игры.<br/><br/>Улучшенный вибромотор совместим со всеми версиями PlayStationn 4: PS.4, PS.4 Pro, PS.4 Slim.<br/><br/>Общие характеристики:<ul><li>Тип контроллера: геймпад;</li><li>Тип связи: беспроводной;</li><li>Виброотдача: есть:;</li><li>Обратная связь: есть;</li><li>Совместимость: PS4, ПК.</li></ul>",Беспроводной джойстик 360 / Геймпад Xbox Wireless Controller,Геймпад для игровой приставки,,,,,,,,,763.804203851292,17,0,0,0,0,0,0,0,0,0,980.6086804713644,1105.0995962048694,1231.1658331085914,18.0,69.0,254.0,18.0,68.0,244.0,1.0,1.0,11.0,646.0104810289641,646.0361057899329,894.4514265672793,1.0,1.0,341.0,5546,1990
344981,0,,"Сменные наконечники полностью совместимы с Apple Pencil 1-го и Apple Pencil 2-го поколения. ( В упаковке разные комплектации, смотрите фото именно той карточки, которую заказываете). Они чувствительны к надавливанию и наклону, поэтому вы можете легко изменять толщину линии, создавать тонкие тени и даже создавать широкий спектр художественных эффектов. Наконечники сделаны из премиум материалов, легко устанавливаются и крепятся. Вы можете выбрать разный комплект наконечником и их типов. Есть Hard HB (жёсткий тип наконечника стилус) и Soft 2B (более мягкий тип наконечника ст",наконечник для стилуса apple pencil 1 и 2 поколения .2 шт,Чехол для стилуса,,,,,,,,,588.4273934248731,147,0,0,0,1,9,96,0,0,5,991.3988310781398,1176.8414807084523,1260.8471252050078,65.0,404.0,1031.0,63.0,388.0,983.0,1.0,4.0,15.0,586.3893238132259,713.900841955084,824.6321701341772,1.0,1.0,206.0,169759,11404
7672,0,Sony,"В Resident Evil Revelations 2 вас ожидает возвращение любимицы геймеров Клэр Редфилд. Пережившая катастрофу в Раккун-сити девушка работает на организацию «Терра Сэйв», которая ведет непримиримую войну с биотерроризмом. Но кошмар возвращается, когда неизвестные похищают Клэр и ее коллегу во время нападения на офис организации. Девушки приходят в себя в мрачной заброшенной тюрьме на неизвестном острове. С этого момента им придется объединить усилия, чтобы выбраться живыми и выяснить, кто стоит за похищением. Cделать это непросто – за каждым поворотом ждут смертель","Игра Resident Evil Revelations 2 (PlayStation 3, Русская версия)",Видеоигра Sony,,,,,,,,,790.2617467804123,1,0,0,0,0,0,0,0,0,0,1069.5093522409695,1292.3797302893756,1426.2262842708187,23.0,158.0,552.0,23.0,155.0,542.0,3.0,9.0,14.0,858.7268662786045,980.011119603876,1033.2996160421349,5.0,5.0,135.0,3869,456
40471,0,Ballu,"<p>Высушить белье за 3 часа, понизить уровень влажности в помещении и сделать воздух максимально полезным для здоровья поможет Ballu BD20U.</p>



<p>Ballu BD20U — это компактный бытовой осушитель воздуха, предназначенный для поддержания комфортного уровня влажности воздуха в пространствах до 30 м².</p>



<p>Высокоэффективный осушитель способен устранить в сутки до 20 литров влаги, работая даже в помещениях с максимальной влажностью. Компактные размеры и возможность транспортировки позволят вам без труда перемещать и устанавливать его в ванных комнатах, кухнях и други",Осушитель воздуха Ballu BD20U,Осушитель воздуха бытовой,,,,,,,,,991.3507397536464,248,0,0,0,0,0,0,0,0,0,1122.2789014072112,1269.3625104850332,1385.3656987864576,16.0,57.0,202.0,8.0,44.0,132.0,0.0,0.0,4.0,0.0,0.0,1087.0653993511648,17.0,17.0,252.0,20237,2052
68616,0,ProFDetali,"Подсветка для телевизора Samsung UE28J4100AW.
Партномер: D4GE-280DC0-R1, D4GE-280DC0-R2, D4GE-280DC0-R3, BN96-30440A, BN96-34140A, LM41-00099N, 2014SVS28, 2014SVS28_3228_06_REV1.1_131108 совместима с телевизором Samsung UE28J4100AW.<br>Диагональ: 28""  <br><br>Информация: 3 планки 560 мм по 6 светодиодов   <br><br>Напряжение диодов: 3v  <br>За комплект: Да <br><br>Перед покупкой сверьте модель телевизора, количество линз, разъем подключения, напряжение диодов. Обязательно обращайте внимание на версию подсветки! В одинаковых моделях устанавливают до 4х разных типов! Магазин Профдетали предлагает широкий ассортимент качественных запчастей для электр",Подсветка для телевизора Samsung UE28J4100AW,Запчасти для телевизора,,,,,,,,,727.9561782313285,92,0,0,0,0,0,0,0,0,0,1334.4190785794867,1491.371336525772,1585.035976383632,168.0,815.0,2280.0,165.0,806.0,2259.0,20.0,88.0,209.0,1109.0713992454707,1259.4029120333678,1348.6321928078978,482.0,482.0,421.0,34302,24
72240,0,Levsha kaluga,"<p>Мы используем только НОВЫЕ комплектующие при сборке ПК.<p><p>С какими производителями мы работаем? Kingston fury, Adata, G.Skill, Msi, AsRock, Gigabyte, Samsung, HP.<p><p>Используем систему жидкостного охлаждения на процессорах от i7.<p><p>Качество сборки: Все компоненты ПК были аккуратно и надежно установлены в стильный корпус. Качественные материалы и безупречная обработка каждой детали создают ощущение надежности и долговечности.<p><p>Качество комплектующих: В основе нашего игрового ПК лежит мощный процессор от Intel, который гарантирует стабильную и плавную работу даже при высоких наг","Levsha kaluga Системный блок Игровой компьютер Андромеда (Intel Core i5-12400F, RAM 32 ГБ, SSD 2048 ГБ, NVIDIA GeForce RTX 3060 Ti (8 Гб), Windows 10 Pro), белый",Настольный компьютер,,,,,,,,,1184.2821033511025,4,0,0,0,0,0,0,0,0,0,,,,,,,,,,,,,,,,402.0,402.0,116.0,35976,442
220333,0,TN,"Новый комплект подсветки 2013SVS40F для телевизоров Samsung 40""<br/><br/>Совместимые модели:<br/><br/>UE40F5000AK, UE40F5000AS, UE40F5000AW, UE40F5005AK, UE40F5020AK, UE40F5030AK, UE40F5030AS, UE40F5030AW, UE40F5300AK, UE40F5370AK, UE40F5500AK, UE40F5500AS, UE40F5500AW, UE40F5700AK, UE40F5700AW, UE40F6100AK, UE40F6130AK, UE40F6200AK, UE40F6200AS, UE40F6200AW, UE40F6330AK, UE40F6350AK, UE40F6350AS, UE40F6350AW, UE40F6400AK, UE40F6400AS, UE40F6400AW, UE40F6410AK, UE40F6410AS, UE40F6410AW, UE40F6500AB, UE40F6500AK, UE40F6500SB, UE40F6500SS, UE40F6510SB, UE40F6540AB, UE40F6510SS, UE40F6640SS, UE40F6650AB, UE40F6650AK, UE40F6670SB, UE40F6740SB, UE40F6800AK, UE40F6800SB<br/><br/>Матрица:<br/><br/>CY-GF400CSLV1H, CY-GF400CSLV2H, CY-HF400BGLV1H, CY-HF400BGLV2H, CY-HF400BSV1H, CY-HF400CSLV1H, CY-HF400CSLV1V, CY-HF400CSLV2H, CY-HF400CSLV3H, CY-HF400CSLV3V, CY-HF400CSLV4H, CY-HF400CSLV4V, CY-HF400CSLV5H, CY-HF400CSLV5V<br/><br/>Совместимые марки",0046 Подсветка для Samsung 2013SVS40F D2GE-400SCA-R3 UE40F5000AK UE40F5000AS,Запчасти для телевизора,0.0,0.0,0.0,0.0,6.0,0.0,5.0,0.0,779.4089870193179,843,0,0,0,0,1,3,0,0,0,1290.0860724346946,1425.7645776242855,1546.7670646806343,412.0,1675.0,5806.0,395.0,1567.0,5342.0,13.0,42.0,141.0,949.9296956223628,1066.8195364776325,1185.3509447280735,11.0,11.0,1283.0,108198,91
81069,1,Sony,Невероятно точный беспроводной контроллер DualShock 4 обеспечивает удобные и интуитивно понятные способы игры благодаря изменённой сенсорной панели с индикатором цвета световой панели. Улучшенные аналоговые джойстики и боковые кнопки обеспечивают точное управление. Встроенная световая панель горит разными цветами в зависимости от происходящего на экране — её цвет отображается на сенсорной панели. С помощью встроенного динамика вы не пропустите ни единого шороха. Предусмотрен разъём 3.5 мм для наушников. Чувствительный встроенный акселерометр и гирос,"Sony Джойстик джойстик ps4 серебристый, Bluetooth, черный",Джойстик,,,,,,,,,738.2590309521383,2,0,0,0,0,0,0,0,0,0,909.1202544234764,1098.8897559492457,1360.300497742793,7.0,49.0,650.0,7.0,46.0,598.0,0.0,0.0,26.0,0.0,0.0,1038.5319247376594,3.0,3.0,171.0,40347,1693
259309,0,Kingston Fury,"Твердотельный накопитель Kingston A400 240 ГБ обеспечивает прирост скорости в работе системы и передаче данных. Модель работает на базе контроллера Phison PS3111-S11, использует чипы памяти TLC. Для подключения к материнской плате привлекается распространенный интерфейс SATA III с максимальной пропускной способностью 6 Гб/с. Скорость чтения и записи составляет 500 МБ/с и 350 МБ/с, соответственно.Емкость в 240 ГБ дает использовать SSD-диск в качестве аналога жесткому диску для настольных компьютеров или ноутбуков. Kingston A400 (SA400S37/240GBKCN) повышает общую производительность системы, ск",Kingston Fury 240 ГБ Внутренний SSD-диск (SA400S37/240G),SSD диск,2.0,0.0,1.0,0.0,2.0,3.0,1.0,1.0,1036.038989947201,6,0,0,0,1,1,1,0,0,0,1071.758028114995,1071.7428469615131,1071.7588515642767,11.0,11.0,11.0,11.0,11.0,11.0,0.0,0.0,0.0,0.0,0.0,0.0,1.0,1.0,12.0,127440,2269
