id,resolution,brand_name,description,name_rus,CommercialTypeName4,rating_1_count,rating_2_count,rating_3_count,rating_4_count,rating_5_count,comments_published_count,photos_published_count,videos_published_count,PriceDiscounted,item_time_alive,item_count_fake_returns7,item_count_fake_returns30,item_count_fake_returns90,item_count_sales7,item_count_sales30,item_count_sales90,item_count_returns7,item_count_returns30,item_count_returns90,GmvTotal7,GmvTotal30,GmvTotal90,ExemplarAcceptedCountTotal7,ExemplarAcceptedCountTotal30,ExemplarAcceptedCountTotal90,OrderAcceptedCountTotal7,OrderAcceptedCountTotal30,OrderAcceptedCountTotal90,ExemplarReturnedCountTotal7,ExemplarReturnedCountTotal30,ExemplarReturnedCountTotal90,ExemplarReturnedValueTotal7,ExemplarReturnedValueTotal30,ExemplarReturnedValueTotal90,ItemVarietyCount,ItemAvailableCount,seller_time_alive,ItemID,SellerID
75405,0,,,"Манжета люка для машинок Samsung Diamond DC64-02857A, DC64-01602B, DC64-01602C, GSK006SA, Vp4303, 117SU06, DC64-01602A","Запчасти для стиральной, сушильной машины",,,,,,,,,799.5493705518874,346,0,0,0,0,0,0,0,0,0,1167.6370889642535,1299.606823195788,1437.3213637954227,98.0,365.0,1480.0,93.0,351.0,1437.0,4.0,25.0,74.0,856.2585037508129,1028.3420932553902,1142.494095355832,46.0,46.0,1379.0,37526,666
398550,0,VIXION,"Аккумулятор на планшет Самсунг с емкостью 7900 mAh обеспечит высокую автономность вашему девайсу. li-ion батарея полностью совместима с указанной в характеристике моделью планшета Самсунг. Компактный источник энергии с напряжением 3.8 v прост в эксплуатации, безопасен и долговечен. Для каждой батарейки Vixion отбираются лучшие компоненты, произведенные по оригинальным технологиям. АКБ Vixion имеет качественные платы контроллеров, установленные для корректировки отдаваемого напряжения. Батарею для сотового телефона можно заменить самостоятельно, но мы рекоменд",Аккумулятор для Samsung Tab S 10.5 T805/T800/T801 (EB-BT800FBC) (VIXION),Аккумулятор для мобильного телефона,3.0,1.0,0.0,0.0,0.0,5.0,0.0,0.0,763.2177375601597,233,0,0,0,0,0,1,0,0,0,1135.7983003098466,1294.8757001648526,1416.6427519567746,83.0,423.0,1458.0,81.0,415.0,1424.0,6.0,18.0,62.0,858.206278932143,976.6426041361603,1116.230514333966,5.0,5.0,468.0,194797,659
139659,0,iQZiP,Клавиатура для ноутбука Huawei MateBook B3-420 NobelDZ-WFH9A топкейс Space Gray,Клавиатура для ноутбука Huawei MateBook B3-420 NobelDZ-WFH9A топкейс Space Gray,Вентилятор для ноутбука,,,,,,,,,933.1641561747632,126,0,0,0,0,0,0,0,0,0,1260.582818175419,1447.669619855906,1583.606420670696,168.0,980.0,3719.0,159.0,949.0,3548.0,11.0,69.0,218.0,977.79013804772,1193.925416549554,1322.9882651288497,7.0,7.0,769.0,68512,15
281002,0,Pro Cover,"<ul><li>изготавливается из премиального покрытия с микроканалами, которые не образуют пузыри при нанесении.</li><li>клеевой слой не оставляет следов, а также при неудачном нанесении покрытия с первого раза, можно повторить процедуру</li><li>мы принципиально не используем логотипы в дизайне принтов, никаких навязанных брендов на вашем устройстве</li><li>покрытие которое не увеличивает размеры и вес девайса, оставляя габаритный дизайн таким, каким его создали в Apple</li></ul>","Pro Cover/Наклейка на телефон,виниловое покрытие Dark Fog на iPhone 14 Pro",Наклейка для телефона,0.0,0.0,0.0,1.0,0.0,0.0,0.0,0.0,683.6493460536582,405,0,0,0,0,0,0,0,0,0,1066.1846731716842,1240.0720993305702,1358.5073063610062,22.0,129.0,438.0,22.0,123.0,417.0,2.0,7.0,33.0,846.3808876487005,935.920540989289,1088.659276419259,6.0,6.0,884.0,138276,137
426490,0,Samsung,"Представляем серию флагманских карт памяти под названием Pro Ultimate, которая была разработана с учетом растущих размеров файлов и повышенных требований к качеству изображений и видео. За счёт своих продвинутых характеристик они способны удовлетворить потребности широкого круга пользователей — от тех, кто использует зеркальные фотокамеры, до владельцев дронов и экшн-камер.<br/><br/>Представители серии  PRO Ultimate поддерживают скорость чтения и записи до 200 МБ/с и 130 МБ/с соответственно. Этого достаточно для работы с большими файлами — например, видеороликами в ","128GB SDXC карта памяти PRO Ultimate C10, U3, V30, A2 (MB-SY128S/CN)",Карта памяти,,,,,,,,,844.1366915400145,222,0,0,0,1,1,7,0,0,0,1347.2854575150643,1478.4861183928,1593.773069123387,162.0,624.0,1995.0,124.0,458.0,1552.0,1.0,5.0,25.0,860.5651762291993,1021.898171800246,1180.1747801832475,8.0,7.0,860.0,207738,1071
64712,0,,"Шлейф для мобильных устройств - это очень важная деталь телефона, которая позволяет соединять различные его компоненты.<br/><br/>В случае поломки смартфона шлейф является одним из самых важных устройств, ведь именно он связывает между собой основные его компоненты, такие как дисплей, корпус, камеру, клавиатуру, динамик, микрофон, батарею и другие.<br/><br/>Поэтому очень важно всегда иметь под рукой все необходимые комплектующие и запчасти, чтобы в случае необходимости выполнить ремонт телефона.",Шлейф для Xiaomi Mi 9T Pro/9T межплатный,Шлейфы для телефонов,,,,,,,,,592.9366170136004,609,0,0,0,0,0,0,0,0,0,1024.4677638720389,1204.4389554399577,1328.803941728104,55.0,337.0,1204.0,53.0,324.0,1150.0,3.0,14.0,53.0,712.5384570291156,920.136458219094,1038.8038152617512,192.0,192.0,720.0,32358,188
158681,1,,"Термопот Kitfort КТ-2509 служит для моментальной подачи воды заданной температуры без предварительного подогрева и ожидания. Термопот не потребляет электричество в режиме ожидания. Подогрев осуществляется проточно, подача воды начинается примерно в течение пяти секунд после нажатия кнопки ""Подача воды"" - столько времени занимает нагрев до температуры кипения. В отличие от чайников термопот не нагревает лишний объем воды, в результате чего значительно экономится электроэнергия. Экономия по сравнению с обычными чайниками до 50%. У КТ-2509 встроенные режимы выб","Термопот Kitfort KT-2509-2, белый (+подарок)",Термопот,,,,,,,,,855.7676378213828,19,0,0,0,0,0,0,0,0,0,1411.622032774713,1540.178949281909,1627.9156303187467,231.0,808.0,1779.0,223.0,785.0,1725.0,10.0,32.0,85.0,1120.0433475086752,1240.14819058645,1344.720341680683,53.0,53.0,890.0,77974,9
376470,0,,,Шлейф для Samsung I9300 с подложкой навигационной клавиатуры,Шлейфы для телефонов,,,,,,,,,529.4153379314098,193,0,0,0,0,0,0,0,0,0,1196.6536942761218,1326.6956691096227,1437.9301997207526,167.0,704.0,2079.0,162.0,670.0,1995.0,11.0,40.0,146.0,939.6724475970874,1070.4824725917504,1200.7962464515017,491.0,491.0,352.0,184755,66
445010,0,Sunways,,Аккумуляторная батарея SUNWAYS GP 12-33,Источник бесперебойного питания и батареи,,,,,,,,,900.4585827387315,341,0,0,0,0,0,0,0,0,0,1339.168326572085,1450.3453973496717,1588.0705327818025,143.0,419.0,1233.0,71.0,181.0,704.0,2.0,6.0,18.0,1025.820428286407,1136.6569282176306,1230.3846813665325,1.0,1.0,362.0,216393,933
79122,0,,"C00378124 481981729331 Электроклапан 2Wx180, [54шт/уп], зам. 481981729015, 481981729024, 481928128203, 481928128223, DC62-00024M Уточняйте через вопрос, совместимость с моделью если не уверены в выборе w 100 (f092415) w 100 (f092415) w 120 (f092416) w 120 (f092416) Электроклапан воды 2Wx180 Whirlpool C00378124 481981729331 |  481981729015, 481981729024, 481928128203, 481928128223, 481981729331, DC62-00024M | Количество катушек: 2 |  C00378124 | Применимость: , Whirlpool, Indesit, Hotpoint-Ariston | Угол: 180 | Комплектация: 1<br>Коды аналогов: 481981729015, 481981729024, 481928128203, 481928128223, 481981729331, DC62-00024M<br>Количество катушек: 2<br>Оригинальный код: C00378124<br>Применимость: Samsung, Whirlpool, Indesit, Hotpoint-Ariston<br>Угол: 180<br>Комплектация: 1",Электроклапан воды 2Wx180 Whirlpool C00378124 481981729331,Запчасти для холодильников,,,,,,,,,767.4427794464389,7,0,0,0,0,0,0,0,0,0,970.1865763298816,970.1877662532896,970.1734055991716,10.0,10.0,10.0,10.0,10.0,10.0,0.0,0.0,0.0,0.0,0.0,0.0,106.0,106.0,11.0,39368,110
356076,0,,Контейнер для сбора пыли для робота-пылесоса Xiaomi Robot Vacuum Mop 2 Ultra,Контейнер для сбора пыли для робота-пылесоса Xiaomi Robot Vacuum Mop 2 Ultra,Пылесборник,0.0,0.0,0.0,0.0,1.0,0.0,1.0,0.0,803.0188922714997,4,0,0,0,0,0,0,0,0,0,1281.2725340890006,1401.8628412794958,1499.5245430507937,87.0,302.0,818.0,85.0,295.0,793.0,3.0,16.0,45.0,984.0314909690526,1100.4607580233728,1224.9162030768678,2.0,2.0,651.0,175129,504
101334,0,Optoma,"Проектор Optoma HD146X – превосходный выбор для спортивных болельщиков, любителей телешоу и игроманов. Режим Gaming Mode оптимизирует настройки проектора для достижения минимального времени отклика при сохранении максимального уровня контрастности и яркости цвета, идеально для любителей видеоигр.<br/><br/>К этой модели легко подключить различные HDMI-донглы (Google Chromecast, Amazon Fire TV or Apple TV) для просмотра потокового видео и запуска игр на большом экране.<br/><br/>Обладающий небольшим весом ( всего 2,8 кг!) проектор Optoma HD146X очень удобен для транспортировки – его можно брать с собо",Проектор для коммерческих инсталляций Optoma HD146x,Проектор,,,,,,,,,1140.7098921764552,83,0,0,0,0,0,0,0,0,0,,,1406.090534586728,,,57.0,,,55.0,,,2.0,,,1036.321812688137,3.0,3.0,86.0,49978,1508
320027,0,Sellerweb,"Адаптер Bluetooth 5.0<br/><br/>Адаптер принимает и передает данные: звука (стерео), изображения, видео, текстовые файлы, файл различных расширений, выполняет функцию пульта управления.<br/><br/>Конектиться по Bluetooth со всеми устройствами: планшет, смартфон, мышь, джойстик, клавиатура, наушники, колонки, фотоаппарат, принтер, МФУ, телевизор, моноблок, монитор.<br/><br/>Контроллеры (джойстики) приставок Sony PlayStation и XBox.<br/><br/>Поддержка одновременного подключения нескольких устройств Bluetooth.<br/><br/>Двухканальный стерео аудио поток в ваши беспроводные наушники!<br/><br/>1. Модель адаптера",Bluetooth 5.0 адаптер,Bluetooth адаптер,,,,,,,,,671.7939580271673,1195,2,4,6,32,116,225,2,7,11,1348.069589869517,1466.969647075594,1588.1096129975244,662.0,2532.0,8671.0,648.0,2453.0,8353.0,21.0,92.0,297.0,997.8660776752148,1147.4544236328934,1270.2691354234796,1.0,1.0,1448.0,157487,5314
45512,0,,Двигатель для пылесоса аналог CPH90F 300004478921 мощностью 1800W для пылесосов Philips,Двигатель для пылесоса аналог CPH90F 300004478921 мощностью 1800W для пылесосов Philips,Запчасти для пылесоса,,,,,,,,,753.3044041431343,20,0,0,0,0,0,0,0,0,0,1288.6815369363867,1394.6239195949634,1461.010868663032,358.0,898.0,1579.0,349.0,883.0,1553.0,16.0,59.0,111.0,988.9253147607276,1131.0399891215343,1201.9007846889217,8.0,8.0,401.0,22722,49
424647,1,,"<p>Наушники с микрофоном, Bluetooth, 3.5 мм, Черный – превосходный выбор для тех, кто ценит высокое качество звука и удобство беспроводного использования. Эти наушники предназначены для истинных меломанов и профессионалов, которым важна каждая нотка и нюанс в любимых треках.</p><p></p><p>Наушники оснащены передовыми Bluetooth-технологиями, что обеспечивает стабильное соединение и высококачественное звучание без помех. С этими наушниками вы сможете наслаждаться музыкой или разговорами по телефону без каких-либо ограничений.</p><p></p><p>Если вам все же необходимо подключи","Наушники беспроводные с микрофоном, Bluetooth, 3.5 мм, черный, серебристый",Наушники Bluetooth,0.0,0.0,0.0,0.0,3.0,0.0,0.0,0.0,301.056223477958,9,0,0,0,0,0,0,0,0,0,,,,,,,,,,,,,,,,140.0,140.0,10.0,206954,501
13598,0,,Мешок многоразовый + микрофильтр для пылесоса SAMSUNG NV9015,Мешок SAMSUNG NV9015 многоразовый микрофильтр для пылесоса,Пылесборник,,,,,,,,,718.8772721257117,817,0,0,0,0,0,0,0,0,0,1466.8411561281912,1614.1646430799449,1742.064624599015,1819.0,7926.0,33017.0,1619.0,7205.0,29686.0,43.0,210.0,762.0,1111.7896723469353,1260.647117478017,1376.3464434698478,246.0,246.0,973.0,6856,198
159294,0,ZipM,"Нож двусторонний №5 для мясорубки Bosch/Бош, Zelmer/Зелмер<ul><li>Длина лопастей: 47 мм</li><li>Высота: 5 мм</li><li>Посадочное место (квадрат): 9х9 мм</li><li>Одним из самых важных элементов любой мясорубки является нож. От него зависит, насколько качественно и быстро будет приготовлен фарш. Именно нож для мясорубки не просто перемалывает мясо, а рубит его. Поэтому он всегда изготавливается из стали (лучше всего, если это будет нержавеющая) и хорошо заточен со всех сторон. Любые другие материалы, из которых могут быть изготовлены ножи для мясорубки, могут требовать очень частой ",Нож двусторонний для мясорубки,Запчасти для мясорубки,,,,,,,,,735.1719218502899,1155,0,0,0,0,0,0,0,0,0,1381.040251512106,1490.2592268923108,1589.4456406829354,742.0,2221.0,5842.0,672.0,2054.0,5298.0,30.0,108.0,322.0,1068.3717711984716,1191.8933890777032,1319.916049113689,10.0,10.0,1282.0,78265,1723
190906,1,LISIK.,"Батарейки типоразмера АА наиболее распространены, поэтому используются во многих приборах: фонариках, электрических щётках, детских игрушках. Помимо широкой сферы применения, такие элементы питания отличаются малыми габаритами: их удобно хранить дома с запасом, а также брать в походы и путешествия.  Используйте щелочные батарейки с любыми устройствами: от тех, которые не создают долговременных и интенсивных нагрузок, до потребляющих значительный ток. Это могут быть как пульты дистанционного управления для ТВ, калькуляторы, часы, так и фотовспышки, ра","Батарейка солевая GP Greencell Extra Heavy Duty, AA, R6-4BL, 1.5В, блистер, 4 шт.",Типовая батарейка,,,,,,,,,651.0721794120161,2,0,0,0,0,0,0,0,0,0,1231.7407551972085,1360.5978128018105,1465.5443908142315,182.0,753.0,2209.0,135.0,623.0,1791.0,6.0,30.0,65.0,910.8417320989528,1034.589880042804,1133.0463862165382,20.0,20.0,315.0,93325,424
368853,0,Cameron Sino,"<p><b>Совместимые партномера</b></p> <ul> <li>EB-BN910BBE</li> <li>EB-BN910BBK</li> <li>EB-BN910BBU</li> </ul> <p>Аккумулятор CS-SMN917SL EB-BN910BBE для Samsung Galaxy Note 4 SM-N910G 3.85V / 2800mAh / 10.78Wh Galaxy Note 4, SM-N910A, SM-N910C, SM-N910FD, SM-N910FQ, SM-N910G, SM-N910H, SM-N910I, SM-N910K, SM-N910L, SM-N910M, SM-N910R4, SM-N910S, SM-N910T, SM-N910U, SM-N910V, SM-N910W8</p>",Аккумуляторная батарея CS-SMN917SL EB-BN910BBE для Samsung Galaxy Note 4 SM-N910G 3.85V / 2800mAh / 10.78Wh,Аккумулятор для мобильного телефона,,,,,,,,,759.7742037340184,854,0,0,0,0,0,0,0,0,0,1457.9026337317748,1598.0376794661504,1706.233583672835,1270.0,5192.0,16032.0,1172.0,4792.0,14769.0,73.0,294.0,995.0,1184.6917869268646,1335.0965474686045,1452.752122424679,1548.0,1548.0,1149.0,181110,69
144765,0,Radiosfera,"Микросхема 74HCT160N (ИЕ9), DIP16, Philips<br/>
Тип микросхемы: Микросхемы стандартной логики<br/>
Производитель: Philips<br/>
Тип корпуса: DIP16<br/>
Тип элемента: Активные компоненты<br/>
 Количество в упаковке, шт: 1","Микросхема 74HCT160N (ИЕ9), DIP16, Philips",Электронные компоненты-запчасти,,,,,,,,,561.1339127529276,7,0,0,0,0,0,0,0,0,0,1275.5524680964584,1428.6261955001803,1539.670911472526,956.0,4367.0,12970.0,687.0,3420.0,10299.0,19.0,102.0,263.0,885.8161438583238,1067.5384866992513,1173.0299945280983,5.0,5.0,1548.0,71083,10
377195,0,Sony,"Признанная серия реалистичных автосимуляторов впервые появится на PlayStation 4, и острые ощущения от  скоростного вождения заставят ваше сердце биться чаще. В сотрудничестве с Международной автомобильной  федерацией студия Polyphony Digital разрабатывает доступную и сбалансированную игру, которая понравится  как любителям автоспорта, так и заядлым гонщикам. Пристегните ремни и примите участие в двух сетевых  чемпионатах: представляйте свою страну в Кубке наций и отстаивайте честь любимой марки в Кубке  производителей. <br><br>Ключевые особенности:<br>- Машины мечты, ",PS4 Gran Turismo SPORT (Поддержка VR),Видеоигра,0.0,0.0,0.0,0.0,2.0,1.0,0.0,0.0,787.5507728008379,286,0,0,0,0,0,0,0,0,0,1051.2658618182495,1186.4989796482394,1317.2773168681051,12.0,37.0,177.0,12.0,37.0,176.0,0.0,1.0,8.0,0.0,740.1313084015648,973.6622076996748,17.0,17.0,511.0,185137,184
288022,0,,"Микросхема S515 (Контроллер питания для Samsung G930F/G935F/J530F/J701F/J710F).Подарите своему смартфону новую жизнь,заменив несправную деталь на новую.Замену данного компонента производить только через специализированный сервис,или силами профессионалов своего дела.",Микросхема S515 (Контроллер питания для Samsung G930F/G935F/J530F/J701F/J710F),Микросхемы для телефонов,,,,,,,,,323.4978809694705,757,0,0,0,0,0,0,0,0,0,1167.7513789840018,1320.9519456421187,1463.638252033653,257.0,1342.0,5486.0,220.0,1156.0,4742.0,12.0,33.0,133.0,831.1198417237306,935.3838426695676,1099.2903962746384,1.0,1.0,1340.0,141730,916
155257,0,,"Многоразовый мешок-пылесборник OZONE предназначен для установки в бытовые пылесосы.
ВЫСОКИЙ УРОВЕНЬ ФИЛЬТРАЦИИ
Пылесборник изготовлен из многослойного синтетического материала, который характеризуется высоким уровнем фильтрации и удерживает частицы пыли и микроорганизмы.
АНТИАЛЛЕРГЕННЫЙ МАТЕРИАЛ
Материал обладает антиаллергенными свойствами и обеспечивает выпуск гигиенически чистого воздуха, защищая дыхательные пути.
ПРОЧНЫЙ МАТЕРИАЛ
Армированный слой гарантирует увеличенную прочность, что позволяет собирать все виды мусора, в том числе оскол",Оригинальные синтетические мешки-пылесборники пылесоса Samsung 1 шт,Пылесборник,,,,,,,,,666.6370939234776,5,0,0,0,0,0,0,0,0,0,946.610466550606,1130.7866625197669,1262.852531990521,10.0,59.0,239.0,10.0,58.0,234.0,1.0,2.0,14.0,670.6701013266518,744.3762504255475,996.3433785577046,1.0,1.0,862.0,76235,819
48337,0,Kitfort,"Электрический чайник с терморегулятором Кіtfort КТ-616 может не только вскипятить воду, но и нагреть ее до температуры 40, 70 и 90°С. Чайник также оснащен функцией поддержания температуры. Температура воды контролируется встроенным в дно чайника термодатчиком. Чайник автоматически отключается при закипании и при снятии его с подставки, имеет защиту от перегрева и защиту от включения без воды. ","Kitfort Электрический чайник KT-616, черно-серый",Чайник электрический,0.0,0.0,0.0,1.0,4.0,5.0,2.0,0.0,853.7335407858759,1184,0,0,0,0,0,0,0,0,0,1165.225140212401,1284.3772210753868,1427.3059497315624,103.0,431.0,1553.0,93.0,396.0,1428.0,2.0,9.0,33.0,850.8098606638467,920.964399724406,1062.1982684375575,3.0,3.0,1261.0,24132,239
