id,resolution,brand_name,description,name_rus,CommercialTypeName4,rating_1_count,rating_2_count,rating_3_count,rating_4_count,rating_5_count,comments_published_count,photos_published_count,videos_published_count,PriceDiscounted,item_time_alive,item_count_fake_returns7,item_count_fake_returns30,item_count_fake_returns90,item_count_sales7,item_count_sales30,item_count_sales90,item_count_returns7,item_count_returns30,item_count_returns90,GmvTotal7,GmvTotal30,GmvTotal90,ExemplarAcceptedCountTotal7,ExemplarAcceptedCountTotal30,ExemplarAcceptedCountTotal90,OrderAcceptedCountTotal7,OrderAcceptedCountTotal30,OrderAcceptedCountTotal90,ExemplarReturnedCountTotal7,ExemplarReturnedCountTotal30,ExemplarReturnedCountTotal90,ExemplarReturnedValueTotal7,ExemplarReturnedValueTotal30,ExemplarReturnedValueTotal90,ItemVarietyCount,ItemAvailableCount,seller_time_alive,ItemID,SellerID
203438,0,WATCH,"Ремешок для Apple Watch - это идеальный аксессуар для украшения ваших электронных смарт часов. Он совместим с умными часами вотч Series 1, 2, 3, 4, 5, 6, 7, 8, 9 и модифицированными версиями серии SE. Мягкий и гибкий гипоаллергенный силикон обеспечивает комфорт и безопасность даже при круглосуточном ношении на руке и не теряет своих свойств при воздействии UF-лучей. Металлическое крепление гарантирует высокую прочность и защиту от износа. Ремень устойчив к механическим повреждениям и обладает стойкостью к загрязнениям и изменениям цвета. Эта модель подходит к наручным ч","Ремешок для смарт-часов Apple Watch Series 1-9 и SE, 42/44/45 мм, силиконовый, черный, длина 240 мм - M/L","Ремешок для смарт-часов, фитнес-браслета",,,,,,,,,579.0839198675786,423,0,0,2,40,148,401,0,5,10,1377.503160050962,1530.2125354659242,1626.7089616539222,3786.0,16861.0,45316.0,3457.0,15413.0,41290.0,61.0,288.0,759.0,971.5996815517836,1132.7029889501864,1231.384903153617,1.0,1.0,1069.0,99595,9107
255222,0,,"Уплотнитель заварочного блока/Уплотнительное кольцо заварного устройства/силиконовый уплотнитель/прокладка силиконовая для кофемfшин SAECO Уплотнительное кольцо заварного устройства, Philips, Saeco, Gaggia 996530059406 <br/><br/>Совместимые, замены: 01.06.003, 140325062, VO.15.070, 140325062, MS-0909501, 1186862, OR ORM 0320-40, NM01044","Уплотнительное кольцо заварного устройства, Philips, Saeco, Gaggia Уплотнительное кольцо заварного устройства, Philips, Saeco, Gaggia 996530059406","Запчасти для кофемашины, кофеварки",,,,,,,,,567.6998364358992,214,0,0,0,0,0,0,0,0,0,1130.548590042163,1192.9537369793222,1415.4348682518191,55.0,113.0,926.0,30.0,78.0,499.0,0.0,0.0,13.0,0.0,0.0,979.1375446017784,1.0,1.0,407.0,125421,2257
273443,0,DOCTOR FILTERS,"Боковая щетка для робота-пылесоса представляет собой 3 лопасти с длинной белой щетиной на концах. Удлиненные нейлоновые щетинки аккуратно подметают пол, очищая его от пыли и мусора в том месте, где основной уборочный вал менее эффективен. При этом все загрязнения сметаются к центру пылесоса, там они сразу же засасываются в мусоросборник. Изогнутая форма щетки позволяет убирать с полового покрытия крупные частицы так, чтобы они не скапливались под ней. Сбоку основания находится небольшой пучок короткой черной щетины, которая препятствует наматыванию в","Щетка боковая 2шт. для робота-пылесоса Xiaomi Roborock Vacuum Mop 1C, Dreame F9, D9, Trouver LDS Finder, Dreame Bot L10 Pro",Набор аксессуаров для пылесоса,9.0,3.0,7.0,12.0,162.0,22.0,21.0,7.0,567.3603401861848,932,0,1,1,9,56,203,1,5,12,1352.1342500076912,1505.2615193128693,1630.6834165520806,1551.0,7037.0,24107.0,1428.0,6398.0,22026.0,45.0,204.0,650.0,1000.6905422866016,1154.1967385940889,1269.9902973145051,2.0,2.0,1612.0,134444,913
204760,1,DENCO store,"Вспениватель молока - это удобное и практичное устройство, которое поможет вам быстро и легко приготовить идеальную молочную пенку для ваших любимых напитков, таких как капучино, латте или горячий шоколад. Этот компактный прибор работает на батарейках или через USB и оснащен специальным венчиком из нержавеющей стали, который создает идеальную пенку за считанные секунды.С помощью вспенивателя молока вы сможете создать пышную и нежную пенку прямо у себя дома, без необходимости посещать кофейни. Просто залейте молоко в подходящий контейнер, включите устр","Капучинатор Kitfort КТ-7119, 500 Вт, 0.45 л, 4 режима, чёрно-серебристый",Вспениватель молока,,,,,,,,,838.6225256314317,1,0,0,0,0,0,0,0,0,0,932.7394778915028,1002.0791971545592,1002.0852502381184,15.0,30.0,30.0,14.0,28.0,28.0,0.0,0.0,0.0,0.0,0.0,0.0,4.0,4.0,43.0,100247,3290
395717,0,,,Пульт для Philips RC-7805 (TV),Универсальный пульт для электроники,,,,,,,,,680.8153605173437,829,0,0,0,0,0,0,0,0,0,,805.5418376116003,972.6036352918524,,3.0,15.0,,3.0,15.0,,0.0,0.0,,0.0,0.0,1.0,1.0,937.0,193495,5657
454672,0,OEM,,Аккумулятор BM4R для Xiaomi Mi 10 Lite,Аккумулятор для мобильного телефона,2.0,0.0,0.0,0.0,0.0,0.0,0.0,0.0,731.8421205780985,647,0,0,0,0,0,0,0,0,0,1140.5224614861877,1271.7846422503458,1377.6970292379356,86.0,335.0,1080.0,86.0,324.0,1060.0,2.0,16.0,60.0,827.7705404407071,962.3063510301338,1097.5985801241,73.0,73.0,1238.0,220612,1108
292913,0,,"Плотный и вместительный одноразовый синтетический пылесборник объемом 5 литров, подходит для строительного мусора, влажной уборки, обычной уборки, плотно прилегает к пылесосу не пропуская пыли.","Мешки-пылесборники одноразовые синтетические (3 штуки), мешки для пылесоса TRIATHLON, MARATHON универсальные для строительного и домашнего мусора",Пылесборник,,,,,,,,,588.4204931834937,2,0,0,0,0,0,0,0,0,0,,,,,,,,,,,,,,,,1.0,1.0,3.0,144071,2583
381601,0,,,Дисплей для Xiaomi Mi 8 (M1803E1A) (черный) In-Cell,Дисплеи для телефонов,,,,,,,,,750.8034639356332,190,0,0,0,0,0,0,0,0,0,1178.1088140087784,1293.1837250299589,1384.1593712123215,87.0,307.0,718.0,87.0,298.0,705.0,5.0,14.0,43.0,902.143698754219,998.255636827278,1108.0575709789557,72.0,72.0,233.0,187087,134
236963,0,,"Кастомная обложка по мотивам игры Detroit: Become Human для PS4.<br/><br/>Мы Создаём неповторимый образ твоей любимой игры с помощью кастомных обложек!.<br/><br/>Наши обложки сделают ваш диск неповторимым и уникальным , аутентичный яркий дизайн не оставит себя без внимания, приближая его к уровню лимитированных изданий.<br/><br/>В продаже ТОЛЬКО ОБЛОЖКА!!!<br/><br/>Обложка без Цензуры!!!<br/><br/>Размер 270х160 мм",Эксклюзивная Кастомная обложка по игре Detroit: Стать Человеком для PS4,"Игровая атрибутика, фигурки персонажей",0.0,0.0,0.0,0.0,1.0,1.0,0.0,1.0,625.7608543794826,173,0,0,0,0,0,0,0,0,0,976.0458626751234,1092.3124087770047,1216.6249771864098,25.0,81.0,276.0,23.0,71.0,233.0,0.0,0.0,1.0,0.0,0.0,633.7695230701482,1.0,1.0,790.0,116319,509
75853,0,,"Мы предлагаем  качественные дисплеи (экраны). Наши модули обладают отличной цветопередачей, контрастностью и яркостью, а  также быстрым откликом сенсора, что обеспечивает владельцу устройства комфортное использование. Вы можете уточнить совместимость с Вашим устройством, а также наличие других дисплеев,  задав нам вопрос в разделе ""Отзывы и вопросы”.   ВНИМАНИЕ! Перед приобретением товара, пожалуйста, убедитесь в правильном выборе модели. Для замены дисплея обратитесь в сервисный центр.",Дисплей для Xiaomi Redmi Note 10 Pro 4G OLED без рамки,Дисплеи для телефонов,,,,,,,,,848.9004606550172,2,0,0,0,0,0,0,0,0,0,1003.3346836250648,1115.5773469010878,1220.8029480610123,16.0,53.0,122.0,15.0,51.0,120.0,0.0,5.0,9.0,0.0,856.3159786875227,962.8658199691204,34.0,34.0,762.0,37767,1445
177127,0,Amperin,"!!! ВАЖНО !!!<br/><br/>Для правильного подбора блока питания необходимо обратить внимание на 3 параметра:<br/><br/>1. Разъем(штекер) для подключения к устройству.<br/><br/>Самая частая ошибка при подборе блока питания!<br/><br/>Одна и та же модель адаптера может комплектоваться разными разъемами, в зависимости от производителя устройства, с которым она поставляется.<br/><br/>К выбору разъема блока питания нужно отнестись очень внимательно, потому что ошибка в 1 мм может привести к тому, что разъем выбранного блока питания не подойдет к разъему устройства: он может не влезть в ра","Блок питания (сетевой адаптер) Amperin AI-XI65CB для ноутбуков Xiaomi, 65W, USB Type-C, код 089305",Блок питания для ноутбука,,,,,,,,,745.278945478838,220,0,0,0,0,0,0,0,0,0,1242.7106754676138,1391.23025635213,1514.2938283509357,253.0,1099.0,3605.0,226.0,960.0,3077.0,9.0,28.0,110.0,922.8878442165686,1039.962304760828,1170.6490646933992,1.0,1.0,1835.0,86763,517
318433,0,iQZiP,,Лоток для SIM-карты Samsung Galaxy Note 10 Lite (N770F) серебристый,Держатели SIM-карты для телефонов,,,,,,,,,655.0247087174348,1,0,0,0,0,0,0,0,0,0,1155.3997983601046,1205.4742664503676,1205.48849352327,48.0,78.0,78.0,37.0,66.0,66.0,0.0,1.0,1.0,0.0,860.7957566251016,860.7936823775416,297.0,297.0,1196.0,156677,6
349356,0,ProFDetali,"Подсветка для телевизора Samsung UE49M5520AW.
Партномер: BN96-39510A, BN96-39511A, BN96-39512A, V6EY_490SM0_LED64_R4, LM41-00300A, S_K5.5/6.2K_49_SFL70_64LED_160129 совместима с телевизором Samsung UE49M5520AW.<br>Диагональ: 49""  <br><br>Информация: 1 планка 598 мм на 64 светодиода   <br><br>Напряжение диодов: 3v  <br>За комплект: Да <br><br>Перед покупкой сверьте модель телевизора, количество линз, разъем подключения, напряжение диодов. Обязательно обращайте внимание на версию подсветки! В одинаковых моделях устанавливают до 4х разных типов!<br></p>",Подсветка для телевизора Samsung UE49M5520AW,Запчасти для телевизора,,,,,,,,,833.9001149105198,2,0,0,0,0,0,0,0,0,0,1346.827016697658,1495.025640678956,1586.997672362656,188.0,829.0,2314.0,185.0,819.0,2293.0,20.0,89.0,209.0,1112.865472471637,1261.6383083282376,1344.271941933065,21.0,21.0,425.0,171979,24
331437,1,Philips Sonicare,"Электрический водонагреватель Philips (Филипс) AWH1603/51(100DA) легко монтируется на стену и имеет нижний подвод воды. В то же время прибор выглядит современно и элегантно. Внутренний бак объемом 100 литров изготовлен из коррозионностойкой нержавеющей стали, что гарантирует длительный срок использования.<br/><br/>При проведении регулярного технического обслуживания и установке фильтра AWP9820/97 гарантия до 10лет.<br/><br/>Особенности и преимущества:<ul><li>Экономичность в работе;</li><li>Снижение требований к качеству воды;</li><li>Нет необходимости в частом очищении;</li><li>Большой эк",Электрический накопительный водонагреватель Philips AWH1603/51(100DA),Водонагреватель накопительный,,,,,,,,,1007.1287089188888,55,0,0,0,0,0,0,0,0,0,1388.6450793594788,1551.6106907773108,1621.589753207436,54.0,367.0,606.0,52.0,325.0,544.0,0.0,5.0,6.0,0.0,1099.4748781278545,1135.9902783012,1.0,1.0,75.0,163265,1561
394927,0,HotComputers,,Задняя крышка для Samsung A305F Galaxy A30 (2019) белая,Корпуса для телефонов,,,,,,,,,592.1074530669066,817,0,0,0,0,0,0,0,0,0,1457.919370163185,1598.0436997786612,1706.2287360309087,1270.0,5192.0,16032.0,1172.0,4792.0,14769.0,73.0,294.0,995.0,1184.6862278431015,1335.1116355345137,1452.76399285484,1548.0,1548.0,1149.0,193059,69
147694,0,HUAYU,"Пульт для телевизора. Настройки не нужны. Работает сразу, после установки батареек.",Пульт для телевизора Philips 32PFL3088H/12,Запчасти для телевизора,,,,,,,,,665.1883792602154,595,0,0,0,0,0,0,0,0,0,1256.9245076400755,1415.5620863438323,1520.731754193616,338.0,1668.0,4846.0,335.0,1649.0,4776.0,12.0,46.0,133.0,920.3230168149006,1042.474458525249,1151.238279658601,31.0,31.0,987.0,72512,270
119810,1,,"Радиоприемник Sven SRP-525,  красный<br><br>Тип: портативный<br>Тип тюнера: аналоговый<br>Разъем USB: 1<br>Разъем для карт памяти: SD/microSD<br>Цвет: красный<br><br>Радиоприемник Sven SRP-525, красный","Радиоприемник Sven SRP-525, красный",Радиоприемник,,,,,,,,,802.2619688838142,54,0,0,0,0,0,0,0,0,0,1214.9903117216836,1404.2921853598134,1543.9169812923467,116.0,703.0,5210.0,100.0,594.0,4222.0,1.0,24.0,121.0,716.7299620978135,1034.283943958109,1152.140099170295,7.0,7.0,645.0,58785,793
294006,0,ProFDetali,"Подсветка для телевизора Samsung UE46F6200AK.
Партномер: BN96-25308A, BN96-25309A, D2GE-460SCA-R3, D2GE-460SCB-R3, 2013SVS46F совместима с телевизором Samsung UE46F6200AK.<br>Диагональ: 46""  <br><br>Информация: 8 планок D2GE-460SCA-R3 по 9 светодиодов 8 планок D2GE-460SCB-R3 по 6 светодиодов   <br><br>Напряжение диодов: 3v  <br>За комплект: Да <br><br>Перед покупкой сверьте модель телевизора, количество линз, разъем подключения, напряжение диодов. Обязательно обращайте внимание на версию подсветки! В одинаковых моделях устанавливают до 4х разных типов! Магазин Профдетали предлагает широкий ассортимент качественных запчастей для элек",Подсветка для телевизора Samsung UE46F6200AK,Запчасти для телевизора,,,,,,,,,862.2027726158752,81,0,0,0,0,0,0,0,0,0,1334.4263106457042,1491.3737419427198,1585.040842752978,168.0,815.0,2280.0,165.0,806.0,2259.0,20.0,88.0,209.0,1109.0514549683603,1259.3847713663322,1348.6308940493675,482.0,482.0,421.0,144618,24
64983,0,Levsha kaluga,"<p>Мы используем только НОВЫЕ комплектующие при сборке ПК.<p><p>С какими производителями мы работаем? Kingston fury, Adata, G.Skill, Msi, AsRock, Gigabyte, Samsung, HP.<p><p>Используем систему жидкостного охлаждения на процессорах от i7.<p><p>Качество сборки: Все компоненты ПК были аккуратно и надежно установлены в стильный корпус. Качественные материалы и безупречная обработка каждой детали создают ощущение надежности и долговечности.<p><p>Качество комплектующих: В основе нашего игрового ПК лежит мощный процессор от Intel, который гарантирует стабильную и плавную работу даже при высоких наг","Levsha kaluga Системный блок Игровой компьютер Пегас (Intel Core i5-12400F, RAM 64 ГБ, SSD 512 ГБ, HDD 1024 ГБ, NVIDIA GeForce RTX 4060 Ti (8 Гб), Windows 10 Pro), бежевый",Настольный компьютер,,,,,,,,,1198.0540792617578,2,0,0,0,0,0,0,0,0,0,,,,,,,,,,,,,,,,376.0,376.0,114.0,32501,442
216382,0,WALLET,"Картхолдер магнитный для Apple iPhone 15 Pro - стильный и функциональный аксессуар, который станет незаменимым помощником в повседневной жизни.<br/><br/>Благодаря точному совпадению внутренних магнитов, картхолдер надежно фиксируется на вашем устройстве.<br/><br/>Картхолдер выполнен из высококачественных материалов, приятных на ощупь. Матовая поверхность и soft touch дизайн придают аксессуару изысканный вид.<br/><br/>В картхолдере предусмотрено отделение для банковских карт, что позволяет хранить все необходимые документы и карты в одном месте.<br/><br/>Особенностью картхолд",Картхолдер для смартфона магнитный (MagSafe) для Apple iPhone 15 Pro-Небесно-Голубой,Картхолдер для смартфона,,,,,,,,,850.0036384030874,119,0,0,0,0,0,0,0,0,0,948.40791883922,1085.3374594868149,1161.442666447061,3.0,12.0,28.0,3.0,10.0,26.0,0.0,0.0,0.0,0.0,0.0,0.0,24.0,24.0,223.0,106212,1280
158130,0,Levsha kaluga,"<p>Мы используем только НОВЫЕ комплектующие при сборке ПК.<p><p>С какими производителями мы работаем? Kingston fury, Adata, G.Skill, Msi, AsRock, Gigabyte, Samsung, HP.<p><p>Используем систему жидкостного охлаждения на процессорах от i7.<p><p>Качество сборки: Все компоненты ПК были аккуратно и надежно установлены в стильный корпус. Качественные материалы и безупречная обработка каждой детали создают ощущение надежности и долговечности.<p><p>Качество комплектующих: В основе нашего игрового ПК лежит мощный процессор от Intel, который гарантирует стабильную и плавную работу даже при высоких наг","Levsha kaluga Системный блок Игровой компьютер Геркулес (Intel Core i7-13700KF, RAM 16 ГБ, SSD 2048 ГБ, HDD 3072 ГБ, NVIDIA GeForce RTX 4070 (12 ГБ), Windows 10 Pro), черно-серый",Настольный компьютер,,,,,,,,,1249.9189297241032,4,0,0,0,0,0,0,0,0,0,,,,,,,,,,,,,,,,402.0,402.0,116.0,77657,442
416550,0,All In One PC,"Компактный моноблок All-in-One - 19 дюйма на металлической ножке

Комфортная для глаз матрица
Подойдет для учебы, работы и в офис
Можно установить Microsoft Office, AutoCAD и слабомощные игры

ОЗУ: 8GB
SSD: 1000GB
CPU: Intеl Соrе i5-2450М
Все комплектующие брендовые!
ОС - Windows 10 PRO (активированная)

Можно укомплектовать офис, школу, торговое помещение, предприятие или для дома","MonoX 19"" Моноблок (Intel Core i5-2450M, RAM 8 ГБ, SSD 1000 ГБ, Intel HD Graphics 3000, Windows 10 Pro), белый, черный",Моноблок,0.0,0.0,0.0,0.0,1.0,1.0,0.0,0.0,1014.284037281067,4,0,0,0,0,0,0,0,0,0,1119.2117261453118,1266.300347078099,1290.2277389073836,4.0,32.0,44.0,4.0,30.0,42.0,0.0,1.0,1.0,0.0,805.8220015059047,805.8319076859092,2.0,2.0,47.0,203054,145
315483,0,Luazon Home,В комплекте 1 шт.,"Пульт дистанционного управления LuazON KDL-0046 для телевизоров Philips, 36 кнопок, чёрный","Кронштейн, подставка для телевизора, антенн и колонок",,,,,,,,,639.9886783795948,5,0,0,0,0,0,0,0,0,0,,,,,,,,,,,,,,,,1.0,1.0,9.0,155310,10811
416066,0,KEEPHONE,"Кабель синхронизации USB-A to Type-C на Samsung Galaxy Tab S9 - это высококачественный аксессуар, который обеспечивает быструю и надежную синхронизацию данных между вашим устройством и компьютером.<br/><br/>Кабель имеет длину 1 метр, что позволяет удобно использовать его в любом месте.<br/><br/>Кабель оснащен разъемами USB 3.0 (am) и USB 3.0 Type-C (m), что гарантирует быструю и стабильную передачу данных.<br/><br/>Особенностью кабеля является его экранированный дизайн, который обеспечивает защиту от электромагнитных помех и улучшает качество передачи данных.<br/><br/>Материал проводника - медь, ",Кабель синхронизации USB-A to Type-C на Samsung Galaxy Tab S9 Силикон 10W 1м.,Кабель для мобильных устройств,,,,,,,,,748.7181495937874,5,0,0,0,0,0,0,0,0,0,1106.0075721179194,1235.6642261499435,1335.4093167254784,19.0,113.0,346.0,17.0,108.0,326.0,1.0,2.0,13.0,837.4399611832279,900.1829977459097,1012.719765926334,6.0,6.0,1127.0,202811,234
437841,1,,,"Xiaomi Power Bank 20000 мАч, Повербанк 20000mah, Внешний аккумулятор",Внешний аккумулятор,,,,,,,,,301.0673003812988,16,0,0,0,0,0,0,0,0,0,1379.1431015533035,1431.6381443696746,1491.6755668393737,501.0,1552.0,4130.0,474.0,810.0,1777.0,9.0,36.0,65.0,968.8049028723096,1087.2161877009903,1143.4621783210523,1.0,1.0,91.0,213069,5268
